"","num","title","content"
"419",596,"ㄹㅇ 언어가 머릿속 생각을 못따라간다는게 참아쉬운일임","         꽤나 자주일어나는 일인데,난는 abcde를 다 염두하고 맥락적으로 말하면(잘난게 아님, 저런만큼 세세하지 못해서 오답인 경우도 많고, 단지 내말이 맞고 틀리고 이전에 소통이 힘든게 유감일뿐)상대는 a,나 b ab일부의미로만 알아듣거든근데 이이상으로 설명하려하면 머리찢어짐사실 그런글을 쓰거나 말을 하는 와중에도 이걸 알아들을 수 있을까 걱정되는데 이걸 말하고 싶어하는 욕구를 자제하는게 힘들어서 그냥 똥싸듯 싸재껴버림업보지 뭐..참던가, 굳이 말하려고 욕심부린 댓가를 받던가 둘중하나니까        "
"420",597,"Entp녀는 어디 많이 출몰하냐?","꼬시고싶다 하앍"
"421",598,"렘 수면vs류크 각성 ㅋㅋㅋㅋㅋㅋㅋ","         어엌ㅋㅋㅋㅋㅋㅋ라이토한테 이드립치면 노트에 적혀서 사망할듯 ㅋㅋ 사인은 자기 개그에 웃다가 숨막혀서 심정지ㅋㅋㅋ        "
"422",599,"엔팁 꼬시기 진짜 어렵지않냐","나 엔팁녀인데 남자가 꼬셔서 넘어간적 단 한번도 없음"
"423",600,"엔팁남들은 이상형이 뭐야?","말해봐"
"424",601,"아 좆같은 한국사회 진심 존나 싫다","         엔팁 병신취급하고해준 것도 없으면서바라는 건 또 존나 많음내향직관 소시오패스들        "
"425",602,"나만 그러냐 ","사람들 만나는거 좋아하고 알아가는거 좋아하는데 단점이 너무 훤히 보임 사소한 그런 단점말고 이 사람이 좀 약았네 이런거 그게 너무 잘보여서 근데 그걸 다른 사람은들은 모르는거 같고 그걸 대놓고 표현못하는 상황이 와서 혼자 그걸 보는게 좆같음"
"426",603,"난 엔팁 성격바꾸러감","살기 힘들다~~~! 성격 바꿔야지!"
"427",606,"엔팁은 연애도 재능충일까?","이렇게 생각하면 모쏠은 없을 듯?"
"428",608,"엔팁 연애하기 힘든게","관심단계는 대놓고 좋아한다 노래부르고 치대는데그걸 그 사람 하나한테만 하는게 아니라서 어장의심받고 썸망함ㅋㅋㅋ근데? 좋아하는걸 내 자신이 알아버리면그 사람 앞에서만 굳고 말을 못하는거야..원래 내가 장난끼가 오지고 애교도 있는데그 사람 앞에서만 어. 아니.ㅇㅈㄹ하니까 지 싫어하는줄알고 좆망"
"429",609,"엔팁중에 카사노바 형 비중이 꽤 높을거임","실제로 카사노바도 찐 엔팁이고단점이 될만한 부분도 장점처럼 포장하는 등여러모로 의지만 있다면 외향직관 주기능을 통한 발상력을 자기 매력을 어필하는 방향으로 쓸 수 있는데그 매력을 유지하는건 엔팁에게 너무많은 노력을 요구하는 행위라..그래서 오래사귀지 못하거나 카사노바일 확률이 높음만약 entp가 꾸밈없이 사는데 그 날것그대로의 entp를 알아주는 여자가 있다면 오래가겠지만"
"430",610,"나만 멍청한거 ㅈㄴ싫냐","대화하는데 상대방 무식한거 티내면 ㅈㄴ답답하고 개싫음"
"431",611,"짧은 시간 매력 발산은 쉬움","자주 보면 결국 어떤 성격인지 드러나지만"
"432",612,"디시위키에 MBTI 설명은 믿을만한거냐","ㅈㄴ 자세하긴 하던데 끝까지 읽기는 개귀찮"
"433",613,"진짜 연락하는게 좁나 귀찮음.","진짜 이기적이고 연락하는 애들한테 미안하긴한데 기본 답장 텀 20시간정도 되는 것 같음 근데 내가 심심하거나 대화 내용 재밌으면 그때만 톡 존나 함. 개찐따였을 시절 생각못하고ㅜㅜ"
"434",614,"지 성격 유형에 부심 가진 사람 많이 봄","         지 성격 유형 + 모호한 자기 자랑예를 들면 나 엔팁인데 누가 봐도 난 엔팁 같다고 하더라 ㅋㅋ 연락 ㅈㄴ 안 봐서 그런가? 뼈엔팁;들으면 내가 다 수치스럽던데 어케 생각하는지 궁금        "
"435",616,"엔팁은 꼬시기 힘들거같긴 한게","자기 맘에드는애 아니면 안중에도 안둘듯 일단 난 그래 "
"436",617,"꼰대 테스트 해보고 결과 좀 알려줘 ㅇㅇ","         궁금해 https://www.lllkkdti.com/        "
"437",618,"이태원 안좋아하는 entp 있을까","홍대 강남 이태원을 성향으로 나타내면홍대는 nf 강남은 sp이태원은 tp 정도 되는 듯해외 안나가도 이국적인 분위기가 너무 좋음"
"438",619,"엔팁 찐으로 사랑에빠지면 똘추되잔아","평소에는 되게 잘웃기고 장난도 잘치고 그러는데좋아하는 사람한테는 뭐만하면 다 무리수 같고 의기소침해지고 걍 개똘추병신같이잇음... 그래서 내 짝사랑 죄다망함"
"439",620,"나는 내가 p인게 이해 안 갔는데","나는 내가 계획적이고 정리도 잘 하는데왜 p 나왔었지 했는데근데 j인 사람 보니까 내가 하는건 아무것도 아니더라ㅇㅇ내가 하는 계획 - 메모장에 나만 알아보게 써놓음내가 하는 청소 정리 - 난 정리한건데 사람들은 어질러놓은줄 앎"
"440",621,"게을러서 너무 싫다","머리속은 복잡하고 해결할 방법이 많아보인다"
"441",624,"나 엔팁이랑 말할 때 짝짝꿍 개잘맞는데","한 주제에 대해서 서로 엄청 재밌게 말하다가도어느 순간 갑자기 말이 끊겨서 흐름도 깨지고 어사됨왜이런걸까ㅋㅋㅋㅋㅋㄱㅋㅋㅋ"
"442",625,"의외로 엔팁 사회성 좋음","눈치빨라서 누울곳 안누울곳 구별은 잘함 "
"443",626,"너네 에니어그램은 머냐","나 7번 "
"444",627,"난 좀 호구인 것 같다.","난 보통 모든 일을 내가 알아서 하거든 "
"445",628,"entp 여친 있으면 좀 로망이 없을 것 같긴 허다.","나도 entp지만 "
"446",631,"자살 얘기를 보고 생각난 건데","내 또래(20대 후 30대 초) 애들은  간혹  "
"447",632,"엔팁의 큰 단점은 안정감을 즐기지 못하는 거에","있는 것 같음.. "
"448",633,"아.....","         뭐 쓰려고 했는데 귀찮아졌다.............        "
"449",634,"엔팁인데 엔팁이랑 사귀고 싶다","         엔팁인데 엔팁과 사귀고 싶다 개추엔팁인데 엔팁하고는 사귀고 싶지 않다 비추동족 혐오를 확인해 보자         "
"450",636,"엔팁여자 연애사 알려준다","19살까지 모솔아다였는데 심심하고 변화 좀 주고 싶어서 나 좋다는 애랑 사귐 근데 처음엔 나름 재밌어서 연락도 꽤 자주 하고 그랬는데 한 백일 지나니까 재미 없고 그새끼가 성욕도 존나 많고 와꾸도 별로라 점점 싫어짐 그래서 점점 연락 안보고 카톡 안읽씹하다가 욕박고 차단함 그래서 나는 연애하면 안되겠구나 느꼈다 그래서 그 뒤로 솔로로 사는데 이게 더 재밌고 나에게 쓸 시간도 많아서 좋음 "
"451",642,"난 검사해보면 entp가 나오기는 하는데","NTP는 거의 확정적으로 나오는데항상 보면 I랑 E가 10도 차이 안날때가 많어그렇다고 INTP가 나온적은 없고..보니까 entp가 다른 e형에비해 사교성이 적다고들어서 생각해봄처음본사람하고도 말은 잘섞고 금방 내편으로 만들긴하는데진짜 내 속마음 다까놓고 말하고, 밖에 같이놀러다니는사람은그렇게 많지 않아사실 주변에 친구가 있어도 나는 모임나가서 즐기고이런거 귀찮아해서 먼저 나가자는말을 꺼낸적이 거의없음근데도 계속 E가 나오는게 신기하더라사실은 조금 에너지넘치는 INTP인가라는 생각도 해보고ㅋㅋ"
"452",643,"엔팁은 입보다 몸쓰는게 더 나음","엔팁이 말을 잘하는 유형이라고 생각하는데말을 많이 해서 좋을 게 없는 유형임근데 몸은 은근히 잘 씀"
"453",644,"쭉 ENTP나오다가","어제 첨으로 유형 바뀜 "
"454",645,"첫사랑이 좋아했던 노래",""
"455",647,"논전이라는 앱이 있어","찬반토론 같은 걸 하는 앱이야 "
"456",648,"아는 엣팁 남자 있는데 섹파하고 싶음ㅎ","가벼운 대화는 완전 티키타카 잘 되는데 그 이상은 아니라서 깊은 사이 되기는 좀 무리고몸 좋고 섹시해서 진심 한번 하고싶음솔직히 살짝 꼬시면 백퍼 넘어올 각인데....이성 챙겨야지...."
"457",650,"지금의 엠비티아이는 불완전함 투성이임","1.창시자가 애초부터 증명이 안되는 문제를(뇌를 뜯어보지않고서는 검증 불가능) 하겠답시고 무리해서2.대중성을 확보하기 위해 논리적 정확성을 희생해서라도 접근 방식을 단순 심테에 가깝게 만들어버려서그래서 사이비 바로 윗단계 정도에 머무를 수 밖에 없다"
"458",651,"entp가 어그로 유저의 비중이 높은 이유","위의 내용과 더불어 또 하나의 경향으로는 악질 어그로로 타락하기 가장 쉽다는 점이 있는데, 이 점은 ENTP가 새로운 관점으로 생각하는데 있어 최적화된 유형이기 때문이다.어째서 이게 이렇게 연결되나? 라고 한다면, 대부분의 어그로 유저의 심리를 이해하는데서 시작해야 할 것 같다. 우선 각종 선동과 날조, 주작으로 어그로를 펼치는 행위가 빈번한 떡밥이 무엇인가? '특정 견해가 정의이고 주류여론이며, 조금이라도 그 여론에 반대되는 의견이 나오면 묻지도 따지지도 않고 묵살되는 상황'이고 이런 상황에 처하면 주류여론에 대항되는 의견을 가진 자의 행동은 크게 3가지로 나뉘게된다. 하나는 그 의견을 내놓고 처참하게 파묻히거나, 또 하나는 ""어차피 건전한 토론과 논쟁은 개뿔 지지리도 대화 못할 판인데 차라리 애새기 ㅈ같으니까 어그로나 끌어야겠다 에휴""가 되거나, 마지막 하나는 그냥 참는 것.그리고 이 주류여론에 대항되는 의견을 내놓기 가장 쉬운 유형은 당연히 앞서말한 특징을 가지고 있는 ENTP.디시위키에 써놓은거 퍼옴(아마도 저 다음이 인팁정도가 되겠지)솔직히 나도 가끔 개판인 곳 보면 저러고 싶긴함"
"459",652,"내가 생각하는 엔팁의 가장 큰 장점","         편견 없는 거 ㅇㅇ타유형들에 비해 일반화나 단정 짓는 게 적고사람이든 뭐든 '일단 들어봐야 알지' '일단 겪어 봐야 알지.' 의 마인드가 있는 듯열린 가능성을 가지고 생각하는 게 습관이 되어 있다는 거지 엔팁이 독특한 아이디어를 많이 가지고 있는 것도 인간관계에서 쿨한 것도 편견 없음이 사고의 기저에 깔려 있어서 가능한 거 같아  반론 잘한다 공부 잘한다 또라이다 등등은 능력치에 따라 좀 다를 수 있는데이건 뭔가 좀 더 보편적? 본질적인 특징 같아서 가장 큰 장점이라고 생각함 + 엔팁 특징 중에 '이상적인 평등 개념을 가지고 있다.' 라는 말에 많이 공감했는데 그것도 이와 맥락을 같이하는 듯.         "
"460",653,"주목해주세요","아임 어그로 "
"461",654,"entp와 intp와의 차이로 알아보는 부기능에 대한 이해","'e'ntp의 부기능이 T'i'고, 'i'ntp의 부기능이 N'e'임Ti가 내향사고, 인식한 일이 무엇인지에 대해 내적으로 검토하는기능이고, Ne가 외향직관, 사물이나 현상으로부터 연결되는 점이나, 새로운 가능성을 인식하려는 기능.e i 는 에너지의 방향성을 뜻하고즉 자신의 기능이긴 하나, 에너지의 방향성이 충돌하기 때문에 능숙하지만 꾸준히 쓰기엔 제한되는 기능이라는거임. 그래서 도구역할을 하는 '부'기능이 되는거고같은 일을 해도 엔팁은 빨리 배우지만, 자신이 받아들인 것을 내적으로 완전하게 분석하기 까지는 비교적 오랜시간이 걸리고(다재다능하지만 진짜 깊이있게 아는건 드뭄)인팁은 천천히 배우지만, 어느정도만 습득되면 주기능 Ti로 인해 순식간에 높은 이해도에 도달하는 차이가 여기서 나오는거지동조건을 기준으로 인팁이 정밀한 대신 발상의 폭이 지엽적이라면, 엔팁은 발상 폭 자체는 무궁무진한데 잘 생각해보면 개논리인 경우가 잦다는 경향도 이와 무관하지 않고 ㅋㅋ"
"462",655,"사실 엔팁은 인터넷하면 자존감 떨굴확률 좀 높음","밖과달리 인터넷은 Ti주기능러 비중 좀 높아서엔팁의 그럴듯하지만 은근히 맹점있는 어설픈 논리가 간파당하고 털리는 경우가 많아짐 ㅋㅋㅋ대신 피드백 받기도 좋아서 또 나쁜건 아냐 ㅎ"
"463",656,"엔팁남 행동분석좀","         얘기하다가 방탈출 얘기가 나와서 내가 갈래? 하니까 같이 재밌게 얘기했단말임내가 고인물이네 나랑가면 잘따라와야하네 그래가지고 난 알아써 너만믿을께!!! 이로고 기대를 잔뜩 했음근데!!! 아무리 기다려도 언제 가잔 얘기가 없는거임 ㅅ0ㅂ참다못해서 같이가자고 본격적으로 불러봤더니 이번엔 또 시큰둥해 생각해볼게래이거 왜그러는거같니? 그냥 가기 싫다는거임? 그럴거면 초장부터 관심없다카든가 짜증나        "
"464",658,"이놈의 핸드폰 뿌셔버리든가 해야지","사실 안쀼실거임 뿌시면 돈아까워"
"465",659,"에고테스트해바 ","인팁엔팁 와리가리하는 난 이거떴어~ https://egogramtest.kr "
"466",660,"나 카드 잃어버렸는데 누가 자꾸 긁음","분실신고 해놔서 ㅋㅋ돈은 안나갔는데 "
"467",661,"ENXP가 모든 외향 유형중 가장 역설적인 유형임","         가장 산만하면서도 가장 정적인..ㅇㅇ외향 유형은 모두 TeFeSeNe 외향기능이 주기능이 되는 유형임여기서extj(외향사고)는 성과를 달성하기 위해 움직여야하고exfj(외향감정)은 주변을 자신이 원하는 분위기로 만들기 위해 움직여야하고esxp(외향감각)은 보이는대로 보고 끝이라 한가지 사물이나 현상을 오랫동안 관찰하기 힘든데유일하게 enxp(외향직관)만큼은 한가지 사물로도 오만가지 가짓수를 펼쳐나갈 수 있음. 즉 하나로도 꽤 오랫동안 거기에만 메일 수 있다는거지어찌보면 이게 enxp가 가장 내향적인 외향형인 이유중 하나라고 볼 수도 있고        "
"468",662,"애인있는 엔팁들아 너네 연락 어떤식으로함?","전에 글 보니 뭐해? 같은 노잼질문 안좋아한다그래서애인이랑 매일 연락하는지 어떤식으로 대화하는지 자주만나는지 궁금"
"469",663,"왜이렇게 쉽게 질리지진짜 환장하네","         내인생 레게노        "
"470",664,"나만 문자함 존나쌓여있음?","스팸 광고 이런거 쓰잘떼기없는거 읽기귀찮고 클릭하기도 귀찮아서 100개넘게 쌓여있음 "
"471",665,"나도 문자함 메일함 남겨놓는데 옛날에 이것땜에 친구랑 싸운적있음","걔가 자기만의 확고한 무언가가 있고 남도 그래야한다 안그러는사람은 이상한애다 이런게 좀 있었거든 "
"472",666,"연애할때 enfp였는데","솔로되니까 entp로 바뀜"
"473",667,"오랜만에ㅋㅋ","다시 검사해봤는데직관이 좀더 올라갔네코로나때문에 집에 있는시간이많아지니까잡생각이 많이늘었단 느낌은 있었는데 이게 직관퍼센트가 오른거에영향을 좀 끼쳤을라나? 여러번해봤지만 이때까지 중 젤 높게나온듯그나저나 계획성좀 더 올리고싶다 ㅋㅋㄱㅋ ㅠ ㅜ"
"474",671,"엔팁한테 하면안되는 행동 뭐가있을것같냐","주변 엔팁보니까 조롱투로 무시당하면 설명하다가 진짜 극대노하는것같은데 어떤행동을 걸러야됨"
"475",672,"살면서 xnfj 를 본적이 없는듯","그래서 먼 성격인지 감이안옴 "
"476",673,"나대는애들 왤케싫지","근데 나도 존나나대 떡관종까진아닌데 ㅈㄴ걍관종"
"477",674,"근데 내 친구들도 내가 카톡답장 안하는거 이해 못해하더라","부랄친구들이 내집 놀러왔을때 카톡 온거 보고 답장 귀찮아서 나중에 할거라니깐 쓰레기래 "
"478",675,"난 카톡 프사 바꿀때만 연락함","연락 주고받고 싶은 애들하고는 맨날 그때그때하는데 관심 없는 애들 연락오면 저럼"
"479",676,"차라리 읽씹하는게 낫다고느낀게","'쟤는 원래저런애야' 라고 들리는게 낫지  의도랑 상관없이 사람차별하는걸로 비춰지면 주위사람들이 서운해하더라 "
"480",677,"아 엔팁인거냐 인팁인거냐?","사람 만나는거 좋아하긴한데 안만나도 상관없고 만나기 전에 커찮아서 잘안만나는데 막상 만나면 좋긴함  검사 할때 마다 10센트 차이로 항상 다르게 나옴 ㅇㅇ... "
"481",678,"요 반가어 여친이 인팁 엔팁 왔다갔다해서 왔어","         빵가어   나는 인프제야일단 여친이랑 다른거 많다고 느끼는데 겹치는거 많다고도 느낌 뭔가 잘 안맞는거같은데 잘맞음 여친이 항상 화나보임         "
"482",680,"엔팁갤도 있다니!!!","믛"
"483",681,"엄마 아빠둘다 isfj인데","가끔 답답하긴 해도 엄마아빠 아니였으면 양아치로 컸을수도 있겠다는 생각듬  "
"484",682,"모든 것은 Ne에서 출발한다","Ne ni se si이 순서로 모든게 진행된다Ne가 아이디어를 내면다른 유형이 따라가는 식이지Ni는 모방의 천재일 뿐 절대로 뭘 생산해내지 못함Ntp가 모르는 사이에Ni는 ntp의 생각을 읽고 모방에 들어감한국사회는 ntp를 병신취급하고댓가도 제대로 안주지물론 ne의 숫자는 많을 필요가 없는게 사실임예를 들어서대부분의 사상도 ne에서 출발함자본주의는 ntp를 보고 만들고공산주의는 nfp를 보고 만들었다고 확신함뭐 이 유형이 모두 성향이 그렇지는 않겠지만.."
"485",684,"입밖으로 못내는 생각들이 상당히 많음","         말로는 어떻게 꺼내도 갑분싸당하거나 혹은 갑분싸는 아니더라도 무시하고 패스당할 이야기 ㅇㅇ걍 개 키모오타 씹덕같고 뭔말을 하는건지 도저히 모르겠을 이야기근데 이걸 얕은관계에서는 어느정도 분위기 고려해서 피하지만진짜 깊고 편한 관계가 될 수록 더더욱 이런 들어주기 힘든 이야기를 쏟아내고자 하는 욕구가 강해짐        "
"486",686,"아니 하나에 몰두하는거 어케함?","애초에 흥미가 며칠간격으로 바뀜 내가 이과성향인지도 문과성향인지도 이성적인지 감성적인지도 "
"487",688,"유튭 mbti 컨텐츠 추천좀","         mbti 드라마 그것 빼곤 다 뻔하고 얕고 극단적이라서 재미없음 f형 감성충 t형 이성충 이런 단순한 논리라 다 별로야 괜찮은 영상 없나         "
"488",689,"ENTP 너네들 진정 트루러브를 해본사람 있니","있다면 어떤 사람 이였어?"
"489",690,"엔하~~","아주 가끔 entj도 나오는 entp 입갤  "
"490",691,"엔팁 특징인지는 모르겠는데","뭐 못한다는 말 들으면 살인충동 든다 "
"491",692,"이것도 엔팁 특징이냐","남이 선톡하면 책읽고 몬헌하고 남친이랑 놀다가 6시간후에 내킬때 답장하는데 내가 선톡할때는 칼답안하면 개답답해서 닥달하는거"
"492",693,"내이상형 착하고 여린 좁밥","         ISFP남이랑 사귈때가 제일 좋았음 괴롭히는 맛이 있어ㅋㅋ        "
"493",695,"여기 진짜 엔팁이 있냐?","인싸라 없을 듯?"
"494",696,"엔팁이 슬플 때","나는 모든 사람을 이해하는데아무도 나를 이해하지 못할 때.사람들은 어딜가든 날 이방인으로 본다"
"495",697,"아 근데 엔팁이 외로운 건","         주변에 사람이 있냐 없냐로 결정되는 건 아닌 듯 같이 놀고 웃고 떠드는 사람 있어도 깊은 얘기를 같이 할 사람이 없으면 외롭더라나 학교 때문에 약간 보수적인 지방? 에 내려가서 살았는데 내 가치관/생각에 대해서 얘기 나눌 사람이 없어서 외로웠음         "
"496",698,"이거 너무 엔팁이다","100000퍼센트 내 기본마인드 "
"497",700,"안녕 바보멍충이드라","         너네들 자꾸 표정에 감정드러나는데 그거아니라고 할때마다 되게 귀여워         "
"498",701,"난 i e 비슷하게나오는데","T빼고 죄다 비슷하게 나오는듯 "
"499",702,"경쟁심 강한 엔팁 좀 부러워","나 경쟁심 줫도 없거든... 막 등수내고 경쟁붙이는거 존나스트레스받고 내 자신 채찍질하면서 일하게 하는것도 스트레스 존나많이 받아서 두가지 방법 사용하면 걍 그 일에서 손떼고 도망침 ㅋㅋㅋㅋㅋㅋ 그래서 감정소모 너무 심하게해서 하나 얼레벌레 하고나면 지쳐서 암것도못해... "
"500",704,"ENTP인데 말더듬는 애들 있음?","그게 난데뭔가 막힌 깔때기 같아서 뒤집어지겠음대가리에서 생각은 뒤지게 많은데 말로 표현하려면아가리가 과부화됨...오히려 긴장해서 생각이 없을 때 말을 더 잘하더라..발표할 때는 말 덜더듬는데 친구들이랑 있으면 버퍼링이 씨발..애들이랑 배그하다가 위치 브리핑 할 때에...에..스스..이방향 ㅈ..적.. 이지랄해서 뒤진게 한두번이 아님..ㅅㅂ"
"501",705,"엔팁은 관심있는 이성있을때 꼬시기 힘들어보이면","계속 도전 욕구 생김?"
"502",706,"안녕얘들아","나 인프제야 "
"503",707,"INTP 에서 ENTP 로 바뀐 썰","         나는 학창시절에 MBTI 테스트하면 언제나 결과가 INTP 였음 4개 항목 전부다 뚜렷한 INTP 그 자체근데 작년에 내가 짝사랑을 하게됐는데그사람 좋아하기전에는 말 잘하고 눈도 잘 마주치다가 호감이 생기니까 어버버버버.. 어버버.. 하고병신도 이런 병신이 없는거야ㅋㅋ용기내서 한다는 말이 ""같이 저녁드실래요..?"" 였는데 그것도 까임근데 진짜 이 사람에 대한 사랑이 너무 커서 도저히 포기할수가 없었어그래서 내가 더 잘난사람이 돼서 이사람 꼭 쟁취해야지 하는 마음 + 아무말도 못하는 찌질한 나를 바꾸려는 마음으로운동도 다니고 공부도 하고 나름대로 열심히 살고 활동적으로 살려고 노력했음결정적으로 나 자신을 사랑하려는 노력도 많이했고..그러다보니 주변에서 사람이 좀 바뀌었다는 얘기를 들었는데며칠전에 MBTI 검사 해보니까 ENTP 로 바뀌어 있었음ㅋㅋ별 생각없이 한건데 내인생에서 INTP 이외의 결과는 처음이었음물론 그렇게 드라마틱하게 바뀐건아니고예전에는 I 가 70퍼센트였는데 지금은 E 가 55퍼 정도로 I 보다 살짝높게 바뀜그래도 되게 신기하더라ㅋㅋ 이게 사랑의 힘인가그리고 또 하나 신기한게오래전부터 알고 지내던 여사친이 있는데얘랑 나랑 서로한테 이성적인 호감이 제로였단말이야가끔 만나서 얘기하는 성별만 다른 친구였는데내가 짝사랑 성공하려고 노력하고 성격이 ENTP 로 바뀌기 시작하니까여사친이 전보다 나한테 연락도 자주하고 친구사이의 호감을 더 많이 표시하더라나는 이게 친구사이의 호감인지 아니면 그친구가 나와 커플이 될 가능성을 열어둔건지 지금도 헷갈리긴하는데알고보니까 그 여사친이 ENTP 랑 진짜 잘어울린다는 INFJ 였음아직도 내 마음 한구석에서 짝녀가 나를 괴롭히고 있지만 이제는 조금 마음이 작아진 것 같아서나중에 만에 하나라도 여사친랑 사귀게 될수도 있나? 라는 생각도 들었음그전에는 진짜 0퍼센트였는데ㅋㅋ암튼 글이 너무 길어져서 3줄요약하자면1. 짝사랑 병신같이 하던 INTP 가 있었음2. 사랑 쟁취하려고 운동다니고 사람 만나다보니 어느새 ENTP 로 바뀜3. 성격이 바뀌니까 전에 없던 새로운 사랑의 가능성이 생김. 근데 그게 신기하게도 INFJ        "
"504",708,"entp에게 사랑이란 뭐여?","         궁금해        "
"505",710,"조용한 애들 너무 궁금해","더 조용히해봐 잔뜩 말 걸어야지"
"506",713,"니네도 그러냐","엔팁 이렇다는 글 올라왔을때 다들 맞다맞다 하고 있으면 괜히 반항심들어서나 아닌데? 존나 일반화 아닌가 니들이 나에 대해 뭘 알아라고 말하고 싶은데 사실 나도 맞다고 생각함"
"507",715,"존나 우울할때","누가 위로해주거나 뭐 먹을거 갖다준다거나 등등 주변에서 아무리 좋은 말 해줘도 나아지지않음 그 사람한테 고마움은 느끼는데 그것과 별개로 계속 우울함그리고 누가 충격요법 이지랄하면서 더 나쁜말하면 진심 찢어죽이고 싶음 기분 더 나빠짐 개좆같아짐"
"508",716,"엔팁들 원래 여자랑 잘 안맞냐","맨날 꽁해서 처 삐져가지고 제대로 말도 안하고지 맘알아주길 바라고 앉아있는거 개꼴비기싫음연애할때도 나는 남친한테 걍 이거 먹고싶다 저거 갖고싶다 뭐 하고 싶다 바로바로 말하는데얘넨 지 남친한테 왜 ㅅㅂ 지가 삐져있아면 다른부분에서 존내게 틱틱대냐 좆같게"
"509",718,"내인생 내가족이나 챙기자","요즘 깨달은 거 "
"510",719,"정준영이 entp 라는데 ","솔직히 내성격상 저렇게 까지 부지런하게 남 못괴롭힘  "
