"","num","title","content"
"315",460,"엔팁들아 너희 짝사랑할때","좋아하는 사람한테 어떻게 행동해말걸고 연락하고 티내 아니면 그냥 가만히 있어?아 그리고 연애감정 아닌 그냥 호감있는 사람한테도 막 연락하고 호의 베풀고 그래?"
"316",461,"Entp 가 원래 엄청 평화로운 유형임","근데 entp가 파괴자라는 별명이 붙은 이유는세상이 entp에게 파괴하도록이끌기 때문이지한마디로 파괴될만 하니까 파괴되는거야엔팁이 파괴하는 경우에는분명히 외부의 자극이 있음"
"317",463,"엔팁은 아이디어를 뺏기지 않게 조심해야함","너도 모르는 사이에 아이디어를 뺏긴다아이디어라는게꼭 언어를 통해서 나와야 되는게 아님Ni를 잘쓰면 상대방의 생각의 흐름을 읽는다Ni유형이 무슨 말을 할 때너가 듣고만 있어도생각의 흐름을 읽힌다는 것임"
"318",465,"솔직히 내가 특이하다고 생각안함","남들이 눈치 많이 보는것뿐이지 솔직히 눈치 많이 봐준다고 나한테 콩고물 떨어지는것도 아니고, 안 맞으면 그냥 빨리 안보는게 맞는거 같음"
"319",467,"엔팁 최고야","엔팁갤이지만 엔팁얘기밖에 안하는 모습 사랑해 "
"320",469,"여기 ㄹㅇ","념글에서 내 복제를 보는 것 같아"
"321",475,"아 사람들이 왜 나를 좌파로 보노","엔팁이면 기본적으로파괴자스러운 면이 있어서 그런가나를 좌파로 보더라노무현이 좌파이기도 했고.그래서 어떤 집단 들어가면괜히 시비터는 관리자들 꼭 있음"
"322",478,"나만 비추 읽씹 조또 신경안쓰냐","짝남이 읽씹하고 무시하지 않는 이상글 올렷는데 비추 박히고읽씹당하고 대화 중인데 대답안하고이러는거 조또 신경안씀내가 좋아하고 사랑하는 사람들 외엔내 뒷담을 까든가 말든가 내알바아님ㅋㅋㅋㅋ누가 나 좋아한대도 안궁금함"
"323",479,"난 사실 어그로 끄는 거 개좋아함","내 관심사 갤 계속 바뀌는데 유동으로 어그로 끌고 놀리는 거 너무 재밌어ㅋㅋㅋㅋㅋ기 "
"324",480,"얘들아 안녕하냐?","처음 와 봤다 반갑다"
"325",481,"다들 휴일에 뭐함?","뭐하며 놀지..."
"326",482,"그냥이라는 말 짱 싫음","세상에 그냥이 어딨어ㅡㅡ"
"327",485,"니네 여기 모습이 본성이냐 왜이리 평화로움? ","존나 어이없음 왜 정상이지 "
"328",486,"너넨 누구랑 제일 안맞냐?","Mbti 중에서"
"329",487,"내가 좋아하는 mc","서장훈 박명수 김구라"
"330",488,"entp가 e중에 제일 내향이라며","난 혼자 있어야 에너지가 쌓이는 타입인데 "
"331",490,"엔팁의 평화를 깨는 것은","         바로 감정임다른 사람들의 응어리 진 감정쓰레기에 영향을 받으면파괴가 시작됨그래서 감정과 멀리하려고엔팁은 고독을 즐기게 되지괜히 가장 내향적인 외향형이 되는게 아님또 고독속에서 많은 성장이 있는 유형이고        "
"332",491,"엔팁이랑 썸탈때 유의할 점 적고가주라","ㅈㄱㄴ"
"333",492,"나는 친구들이랑 버스나 지하철 타는 게 싫어","집에 오는 길에그냥 혼자 조용히 가고 싶어내가 인팁인 줄 알았던 제일 큰 이유 ㅋㅋ"
"334",494,"눈치보게됨","이도저도아니게되는ㄷ니ㅣ내자신을 잃긴싫고 남 맘아프게하는것도싫어이런생각하는 내가 이제 entp가아니게된걸까"
"335",497,"절친이 INFJ여서 좋은 점","어릴 적부터 쭉 친구인데 "
"336",499,"엔팁하고 카톡하는 방법 ","일어나고 먹고 자고 하는 부분의 안부를 전달하는 건 별로 반응이 없을거고 뜬금없이 화제를 던지고 말장난을 걸어야 함 Ex) 굿모닝 (x) 뜬금없이 이미지나 기사 링크 하나 보내고 헐 쩌네 (ㅇ ; 다만 흥미를 가질 수있는 부분에 대한 것이어야 함) "
"337",500,"MBTI 갤러리에서 떡 돌리러 왔습니다.","반갑습니다. "
"338",504,"다음 대선은 이재명 vs 윤상현 싸움일 거 같음","보수쪽에서 친박 다시 살아날 것 같고..이재명이 민주당 후보로 나오면보수쪽에서 상대할 만한 인물이 거의 없어이낙연은 사실 인기 존나 없음대깨문들 이낙연 별로 안좋아함"
"339",505,"엔팁한테 좋은소리 못듣는 카톡들 딱 알려준다","뭐해?ㅎ 일어났어?ㅋㅋ 밥먹었어? 뭐먹었어? 아~ 맛잇엇겟다 ㅎ 그거좋아해? 다음에 같이 먹으러가자 ㅋ "
"340",506,"그래서 난 관심있는 사람이랑은 단둘이서 안만나고 갠톡도 잘 안함","난 그사람을 알고싶고 뭐 사귀든말든 그건 나중일이라고 생각하거든 친구로써의 관계도 마찬가지고 "
"341",507,"mbti 입문했는데","여러번 해도 다 entp 나와서이곳저곳 설명 읽어보고 여기까지 오게됨ㄹㅇ 소름돋는다 내 성격 되게 지랄맞다고 생각했는데16개중에 성격이 들어맞는게 있는게 신기하고생각보다 나랑 똑같이 사는 사람이 ㅈㄴ많구나하고 보는중진짜 다공감됨ㅋㅋㅋ이런기분 처음이야"
"342",508,"도와줘","내자신을 잃기싫어ㅜ싸움걸어줘"
"343",509,"기분이 날씨 엄청 타네","오늘 좀 가라앉고 우울해비 오는 날마다 이런다"
"344",510,"내가아는 엔팁은 엄청 착하던데","단톡에서 친구한명이 코로나바이러스 의심된다고 하니까 "
"345",511,"나 궁금한 거 있는데","         엔팁들 인터넷에서 많이 나댐(? 난 인터넷이나 카톡 문자 이런 텍스트 텐션은 원래 텐션보다 한참 낮아서 나만 그런건지 궁금하네 MBTI 갤 때 엔팁이라면서 관종짓 하는 사람 꽤 있었는데 좀 신기했거든 근데 또 여긴 분위기가 좀 달라서. 너네 생각은 어때?         "
"346",512,"디씨엔 하도 가치관 병신인 미친놈들많아서","말싸움하게되 정의구현 존나했음 "
"347",513,"엔팁 자체는 나쁘지않아","난 항상 새로운 거 재미있는 거 흥미로운 거 찾아서 미친 짓도 해보고자극적인거 찾아다니고 좋아하는 거 하고관심없는건 무시하면서 잘 살았는데난 어딜 가나 호불호 갈리는 사람이더라고그렇다고 못되게 군 적은 없어 그냥 관심을 안준거고 마이웨이한거지그렇다고 날 바꿔야한다고 생각한 적은 없음각자 추구하는 가치에 따라 서로를 평가하는 건데나는 그 몇몇의 주관적 기준에 의해 상대적 불호가 존재하게 된거지 내 행동양상이 피해를 끼친 적은 없어내가 좋아하는 사람과 관심사에는 정말 많은 걸 쏟을 수 있지만 그 경우가 아니라면 기빨려서 싫어해,,,,"
"348",514,"INFJ 랑 결혼했는데","존나 순두부같아서 처음 몇년간 부부싸움아닌 부부싸움하믄존나울린듯왜우는지 이해불가즙짜는 치트키같아서내가한말 틀린거없는데울면사과해야해서 더빡쳤던 기억이나네"
"349",515,"너네 이상형뭐냐","나는 존나완벽한 철벽남인데 어디 모자란 부분 발견했을때"
"350",516,"엔팁은 착한데 이기적이야","근데 자기가 이기적인걸 알아서 나한테 피해만 안주면 이기적인거 크게 신경안쓰는거 같아 "
"351",517,"ENFP 였는데","학생때 꼭 나 싫어하는 양아치 한두명씩있고사회생활하면서 쓴맛보고다니까남들 약점 파악해서 겉으로는 착한척 속으로는 사이틀어지면목조를 생각만하는 ENTP가 되었다...갤보고나니까Entp는 후천적으로 만들어지는 거라구..?그거 보고나니까 조금 멍하네한국에서 살기싫어서 외국사람이랑 결혼했는데ENTP는 국제결혼 괜찮은것같아..근데 결혼하고도 결혼생활에 충실하기가 어렵다잔정 없는건아닌데 진짜 마음이란게 뭔지 잘 모르겠어싸이코패스보다는 좀 소시오패스인가봐주변 친구 가족들이 나 소중하게 생각해주는거에 비해난 사실 그들이 사라진다면 때때로 슬프겠지만나에게 큰 변화가 있을것같지는 않아또 다른 사람 쉽게 사귈수있으니까..맘에드는 이성있으면 기혼자인데도 둘다 맞는 로직이어서안들키면 그만, 어떻게 사랑이 영원해/다른사람 마음 배반하면 안된다는거요 두가지가.. 힘들다그냥 취미인것같아"
"352",518,"너네 가족한테 크게 영향받음?","난 간섭당하는게 너무 싫어 ㅜㅜ 뭔가 불효같긴한데 내자유가 더 중요한것같아 "
"353",519,"엔프제 친구랑 의견 안맞는거","만약 학교같은데서 ㄹㅇ싫은 사람이 나한테 인사걸어도난 그냥 대충 인사받아주고 다른말없이 넘기는편이거든근데 엔프제 친구는 그거 가식이라면서 싫으면 싫은티 팍팍내야한다며 대놓고 티내서 싹을 잘라버리는게 맞다함난 다음에 또 인사한다는거보다 그 행동으로 인해 걔가 나에대해 ㅈㄴ 여기저기 떠들고다니면 더 귀찮을거같아서 저리생각했음내 주변인들 물어보니까 전자 후자 반반이더라이것도 엔팁 성격따라 가는거임? 아님 상관없이 내가 가식인건가"
"354",523,"엔팁을 상징하는 동물은 사자다 ","밀림의 왕이기 때문이지 회사일도 미루는 새끼들 "
"355",524,"s랑 안맞는다 느꼈을때","첫번째는 같이 프로젝트 진행하는데 내 머릿속에 있는걸 설명했는데 이해못하고 구체적인 예시 요구했을때. 한두번이 아니라 모든 건에 그래서 답답했음두번째는 내가 평소에 뭐 볼때마다 영화, 드라마 등이 생각나는 경우가 많아서 여기는 ~같다, ~한 느낌인것같다 이런 말 자주하는데 s 친구가 한심하게 봤을때내가 겪은게 특이한 케이스고 과하게 일반화한건가?나는 진짜 잘맞는다고 생각하는 사람중에 s는 하나도 없었는데 나만 그런건가 궁금해서 적어봄"
"356",525,"음 엔팁 이상형 정리해본다","(얼굴 키 패시브) "
"357",526,"다른 N유형과 NTP의 차이점","         NTP 유형은가장 정치적 의도가 없음반면에 다른 N유형들은 상당히 정치적임행동 하나하나에 정치적인 의도가 있지        "
"358",527,"난 순하고 모지란남자가 좋은데","물론 잘생긴건 당연한거고 서강준 위너진우같이 백치미있는 남자가 좋음 내말에 순응 잘할거같아"
"359",528,"입버릇 : 해봐야 알겠는데요?","뭘 상상까지해 그게더 고생임"
"360",529,"이상형은 나보다 쌔면안되","나보다 귀여운사람이 이상형임 "
"361",530,"니네도 전남친 미련 오지냐","전남친은 아니고 전썸남인데상처준게 너무 많아서 너무 후회되고 미안하고 미치겠는데이게 8개월째다..진짜 염치도 없을 지경이라 혼자 씨발 발라드들으면서눈물그렁그렁하면서 주접싸고있다 씾발심지어 걔 잇팁이야"
"362",531,"귀여운여자가 이상형임","이상형이라기 보다는 걍 귀여운애들한테 끌리는거같아ㅎㅎ  자기는 멋있는줄아는데 내눈에는 귀여워보임 "
"363",532,"엔팁갤 남녀비율 조사","댓글 ㄱ "
"364",533,"니네 사람에 대한 의심 많냐?","난 의심 존나 많음 잔소리하여 바뀔거라는 기대도 안함 "
"365",534,"엔프제 존나 싫다 ㅋㅋㅋ","주변에 있으면 존나 기 빨림개싫어 ㅋㅋㅋ"
"366",535,"S랑 j 안맞는게","난 거시적으로 보는 편인데 얘네는 미시적임나는 대충 이래 이래해서 결과물이 이러겠다 윤곽을 잡는 편이라면 sj 애들은 존나 쓸데없는거로 싸우고 있음 그게 중요한게 아닌데"
"367",536,"나는 다른 사람들 상처주고 싶지 않다","그러느니 차라리 내가 상처 받고 말 것 같아나는 사소한 걸로는 신경도 안 쓰이고 설사 받는대도 금세 잊어버리니까누군가가 내가 툭 내뱉은 말로 상처 입은 걸 알게 되는 게 참 사람을 안절부절 못하게 만들어특히 동성 친구들을 정말 많이 무심하게 대했던 것 같아ㅠ이상 TF 반반인 엔팁이었읍니다,,,"
"368",537,"인프제랑 관계 다들 어떰","나는 아직 별로 안 친하지만 서로가 서로한테 호기심 폭발해서 이 인간 나랑 진짜 다른데 진짜 똑같다 하면서 스캔하는 관계"
"369",538,"사람들원래 entp좆같아함?","ㅋㅋㅋㅋ"
"370",539,"엔팁 기준 더 빡치는거","1. 유도리 없게 자기 주장 내세우는 사람 상대할때,2. 관심없는거 계속해야할때,3. 무시당할때"
"371",540,"엔팁이 나르시즘 개심하냐?","나 거의 자기애성 인격장애일 정도로 심함 내 주변 사람들도 다 인정함 나는 잘난 맛에 산다고ㅋㅋㅋ"
"372",541,"나는 늘 나 자신을 위에서 관조하고 있는 느낌이야","절대 어떤 상황에 녹아들거나 하나가 되지 못해예를 들면너무 슬픈 일이 있으면 눈물을 흘리고 슬퍼하는 내 자신을 또 다른 내가 마치 제3자처럼 관찰하고 있음너네도 이러냐이런 것 땜에 가끔 내가 진짜 고장난 인간처럼 느껴짐;;;"
"373",542,"난 스트레스 많이 받는편인데","자고일어나면 멀-끔한게 계속 반복"
"374",543,"기억은 남는데 감정이 안남아","어느 상황에서 누구랑 뭘했는데 힘들었고 슬펐다, 또는 화난다 분했다 이런 기억은 남는데그 감정을 다시 느끼진 않는듯그냥 책 읽는거 같아 맞아 내가 그랬지 이 정도의 감상평정도?나만 그래?"
"375",544,"미국인들이 뭔가 entp 개많음","개인 사생활 존중하주면서도 놀때는 오지게 한바탕 놀고끝나고 또 각자 생활 살고 인간관계 집착도 없고"
"376",546,"공감능력이 엔팁한테 좋은 건 아닌듯","공감능력이라고 하면다른 사람 감정에 예민하게 반응하는 거잖아Infp 같이 감정적인 유형한테는공감능력 있는 사람이 천사일 수 있어도엔팁한테는 좋은 유형이 아님엔팁은 감정적이지 않고자기감정도 잘 모르잖아오히려 공감능력 있는 사람들이엔팁을 잘 이용해먹음특히 엔프제 같은 유형이 엔팁 이용 존나 잘함"
"377",547,"mbti라는게 비슷한사람을 모아둔거지","같은사람을 모아둔게아님 "
"378",548,"Entp예쁨받는법","아가리 닥치고 암것두 몰라융 불쌍한 척 "
"379",549,"내가(혹은 엔팁이) 이용당한다고 느낄 때가","         1. 아이디어 빼앗길 때  이건 이 갤에서도 한번 언급이 된 적이 있는 주제였던 것 같은데 (글 내가 쓴건 아니었음) 뭔가 빠르고 쉽게 아이디어를 뽑아내는 편이라 그런지 사람들이 그걸 갖다 쓰는데 별다른 부채의식이나 죄책감을 느끼지 않는 것 같음  2. 나쁜놈이나 또라이로 후려치기 당하며 타인을 올려치는 수단으로 사용되기이 두가지인데, 저거에 대응할 방법을 아직 찾지 못했음 그리고 아예 호구잡히는 정도의 케이스가 되진 않지만 그렇다고 주변 사람을 이용해서 이득을 취하지도 못하는 것 같음 저런 상황에 대해서는 어떻게 대처하면 좋은 걸까 ?        "
"380",550,"기억은 남는데 감정이 안남음, 망상은 많은데 미래는 생각안함","ㄹㅇ공감"
"381",551,"원래 ENTP/INTP가 많이 어리버리함??","일단 난 ENTP/INTP 인데 왜 그런진 난 도저히 모르겠지만 어렸을때부터 지금까지도 어리버리하단 소리 진짜로 서러울정도로 늘 많이 들어왔음. 원래 ENTP 또는 INTP가 어리버리함???"
"382",553,"엔팁들 너희도 이래?","어떤 사람들하고 친해지는 건 좋은데 계속 그렇게 지내는 건 뭔가 또 질림... 재미없어지고 "
"383",554,"근데 엔팁은 자존감 살리며 사는게 나은것같음","         물론 선이 있어야 하지만 남의 인식 생각한다고 진짜 안하고 쭈그려있으면 병들음 ㅇㅇ..        "
"384",555,"전전여친 앤팁이었는데 잘 안맞았던거같음","말때문에 싸웠던적 많았고생각도 많이 달랐던거같음"
"385",557,"님들 시험떨어져서 힘듬 엔팁 수험생들 잘삼?","ㅜㅜ"
"386",558,"가족이 별 도움 안되는 유형","Entp intp infj가족들이 좆같은 경우가 많음가족문화는 기본적으로 fi 유저한테 유리함"
"387",559,"수험생때 우울증 극복한거","저는 그냥 일개 학생이고 "
"388",561,"우울증 있는 엔팁있냐","좀 자고 일어나면 리싯되는데 계속 강도 심해져서 넘  힘든갈"
"389",562,"수험생활 하는 엔팁을 위한 조언","         1. 스터디는 하는 쪽이 좋다. - 외향형이고 산만한 엔팁이 나태함에 빠지지 않게 하는 데 도움이 된다. - 사사로이 만드는 거지만 목표가 확실하고, 개인적 감정보다 목표가 앞서는 형태의 인간관계인 스터디는 꽤 ENTP가 좋아하는 형태의 인간교류형태이므로 수험생활 버티는 데에도 도움이 된다.2. 1등강사를 고집할 필요는 없다.- 아무래도 세상은 SJ가 다수이고, NP 스타일은 학원을 적게 다니고 스스로 들이파는 성격이 있다 보니 수험가의 주류 학습방법은 SJ에 가까워 질 수밖에 없다.   (기계적 암기, 두문자 등등)- 사람들이 따라가는 대로 따라가지 말고 샘플강의 잘 들어보며 스타일 맞는 사람을 선택해야 강사와 시너지가 나온다. 책도 마찬가지로 소신대로 결정해야 한다. - 본인은 합격자 중에서도 상위 10퍼센트 안에 들어갈만한 시험 결과를 만들어 냈지만 모의고사 시험에서는 기계적인 채점 기준 때문에 늘상 하위권에 맴돌았었다. 내가 그 기계적 채점기준에 억지로 맞추었다면 합격하지 못했을 수 있다고 생각한다.3. 적어도 시험 100일 전에는 집중할 수 있도록 여건을 만들어 둬야 한다.- 다소간에 산만해지거나 좀 노는건 괜찮은데, 시험 100일 전까지 자기 실력이 충분히 쌓여있다는 판단이 들지 않는 경우 본인이 그 해 시험을 스스로 놓아 버릴 가능성이 생긴다.    4. 아 한가지 더, 모의고사에 집착하지 말자 - 병신같은 승부정신이 발동해서 모의고사 존나 열심히 준비하는 경우가 생길수도 있는데, 시험은 장기전이므로 길게 봐야 한다. 때로는 단기기억에 의존하지 않고 내가 모르는 부분을 찾기 위해 준비 안하고 모고 보는게 더 효과적일 수도 있다.        "
"390",563,"나는 공부할때 자꾸 현실부정 하려고함","모의고사도 보고 위치 확인하고 그래야되는데자꾸 기출만 보면서 자기위로하려함 ㅠ어떻게 극복하냐 이런거"
"391",565,"화 조절 잘하는 엔팁 있냐? 노하우좀","         진심 화 컨트롤못해서 속에있는 할말 못할말 욕설 다하고 살다보니가족관ㄱㅖ 인간관계 연인관계다 십창날거같은데어케 화컨하냐 노하우좀..        "
"392",566,"난 내가 덕질하는 곳 정치질 꼭 함","분위기 보고 바로잡아야할 부분 보이면  "
"393",567,"엔팁이 다이어트를 성공 할 수 있는 방법이 뭘까","내가 살면서 다이어트 한다고 10번은 넘게 말한 거 같은데 "
"394",568,"차라리 대가리 꽃밭이면 우울하지도 않을텐데","어째 Enfp일 때 보다 Entp인 지금이 더 우울하노(물론 엔픕이 대가리 꽃밭이라는 말은 아니고 나는 그랬음)"
"395",569,"엔팁은 국내보단 해외가 나은것같기도","한국에선 어그로 분탕꾼에 어르신들이 안 좋게 보는데 외국에선 트러블이 한국에서보다 적어지는 엔팁들 꽤 봤어 나도 엔팁인데 좀 그랬던것같고"
"396",570,"난 엔팁이고 좋아하는 친구들 infj가 제일 많음","적을 많이 두는 타입이라 내 친구들은 다 착한 놈들밖에 없는데 그중에서도 뭔가 inxj가 많더라난 e이고 나대는데 뭔가 i로 좀 차분한 사람한테 좀 더 끌리고 게으른 p라 계획적인 j한테 끌리는것같아 근데 n이 아니라 s인 사람들은 뭔가 기빨리더라 자기 주장 뚜렷한 n이 좋아"
"397",571,"같은 엔팁이랑 만나면 항상 둘중 하나였던것같음","존나 잘 맞거나 아니면 개싸우고 적되거나"
"398",572,"Infj랑 entp랑 왜 잘맞는다고 생각함?","?"
"399",573,"서서 졸아본 사람 있음?","보닌"
"400",574,"아빠 술마시고 들어왔는데","1년에 두세번 엄마나 나한테 열받아서집밖에 나가서 술먹고 올 때 있음다음날엔 어김없이 술몸살함 지금 아프다고 난리임난 아무 생각이 없음가족 간에 의견 안 맞을수도 있고 갈등할 수도 있지꼭 술마시러 나가버리더라 자기 화 주체못하고맨날 같은 레파토리에자기 지병 있어서 술마시면 안되는데 니네 때문에 화술 먹는다고 맨날 남탓함어제는 새벽에 집와서 토하고 자던데원래는 술마시고 오면 집안 기물 다 부수고나랑 엄마 존나 팸문제는 나랑 엄마랑 문제없고 잘 지낼때도술먹고 개되면 그냥 팸 근데 이제 늙어서 그 짓은 못하나봐아무튼 아무 동정심도 미안함도 안들어누가 술쳐먹으랬나 맨날 다음날 어깨아프다 다리아프다 지랄임 병신"
"401",575,"착한 남자, 여자 (이성) 어떠냐?","         내가 안사랑했던건가 모르겠는데한없이 착하고 잘해주는 성격보다내맘대로 안되고 휘둘르지 못하는 사람에게 매력느낌...어케든 길들이려고 하는데 안되는사람이라고 해야될까그런 사람한텐 사랑한다느끼고 내가 되려 질질끌려댕김맘대로 되면 질려서 헤어지고 존나 나만그럼?천사 ISFJ 들이랑 결혼하는 엔팁들 있던데난 S형이랑은 안맞는거같음..지금 내맘대로 안되는 애가 INTP 라서 개짜증..ㅋ        "
"402",576,"ENTP성격이 희미해져버리는건 아닐까싶음","맨날 심심해서 미쳐버릴것같고 "
"403",577,"나의 수험생 극복법 ","고등학생때 공부 거의 안 하고 재수를 시작했는데 "
"404",578,"친구만날때 나만 이럼 ??","1대1에선 말이 잘 안나오고 불편하거나 좀 별론데 "
"405",579,"엔팁들아 어르신들 살갑게 잘 대하냐?","나 e인데도 어른 아이 할 거 없이 좀 나이차이 많이 나면 대하기 어렵다 "
"406",581,"너희들 아이큐는 몇임???","내가 124임 유튜브 보다가 평균 4위던데 느그들은 어느정도되냐 "
"407",583,"요즘 검사하면 인티제 계속 나오는데 성격은 엔팁이야","이런 경우는 걍 엔팁으로 알고있으면 되는 거지?아마 지금 내 상황 때문에 인티제로 나오는 것 같음"
"408",584,"Enfp 잘 맞을 때가 많긴 한데","주기적으로 징징댈 때 좀 버거움그 외엔 커여운 유형"
"409",585,"엥 다이어트 그거 회사다니면 저절로 되는거아니냐","시바꺼 아침못먹으니까 하루 2끼하게되던데 ㅎㅎ "
"410",586,"이상적인(되고싶은) MBTI 성격 있냐","         나는 성격이야 되고 싶다고 해서 되냐 하는 생각이었는데그래도 부럽다거나 저 놈처럼 살면 인생 웃기긴 하겠다 싶은 유형은 있었어ESTP 걍 적당히 간지가 나는 듯 이유는 몰라         "
"411",587,"intp인데 구경왔다","         걍 평범하네        "
"412",588,"세상이 나처럼 아름답다면 참 살기 좋을텐데","항상 씁쓸해... "
"413",589,"엔팁의 로망이 뭐냐","궁금함"
"414",590,"씨맥 보면서 entp 이거 동질감 존나느낌","         언변, 그 중에서도 변론 쪽에 일가견이 있는 유형으로 널리 알려져 있는데, 여기에는 '심리적인 문제가 없고 말을 해야하는 부분에 대한 충분한 이해도가 깔려있음을 토대로, 오로지 이야기 하는데만 자신의 모든걸 쏟아부을 수 있는 상황' 이라는 전제가 필요하다. 오히려 생각하면서 말을 해야하는 상태의 ENTP가 자신의 생각을 풀어놓으려하면 높은 확률로 ENTP 스스로 뇌정지가 오거나 상대가 그 ENTP의 말을 알아들을 수 없어서 대화의 흐름이 작살나는 현상이 발생한다. 특히 막히는 부분을 요령있게 모른다고 말하고 넘어가는 습관이 잡혀있지 않은 경우가 많아서 더더욱. 이는 ENTP가 내적인 정리를 거친다기 보다는 순간적인 발상에 의존한다는 점에서 이유를 찾을 수 있다. 미리 정리가 되있어서 정리가 필요없는 상태에서는 즉흥적이고 폭넓은 발상을 담당하는 외향직관으로 인해 재치있고 전달력 있는 언변을 보여주지만, 막상 정리와 전달이 동시에 필요한 상황에서는 갈피를 잡기가 힘들어 하는 것.사실 디시위키에 내가 써둔 부분이긴 한데 ㄹㅇ 씨맥 인방에서 c언어 남발할 때랑 피드백할 때 갭보고 ㅈㄴ 느낌 쟤는 좀 극단적이긴한거같지만ㅋㅋㅋ        "
"415",591,"너네 가족들이랑 mbti 비슷함?","엄마 아빠 동생 다 enfp인데 나는 entp임 "
"416",592,"난 약간 남들이 챙겨줘야하는 타입인뎈ㅋㅋㅋ","길치에 어리바리 존나게까고 요리도 못함 "
"417",593,"entp한테 최고의 칭찬","재능충 "
"418",595,"싫어하는 성격 적고가","ㅈㄱㄴ댓글 많이 달아줭"
